59,10694,البيولوجيا – الجيولوجيا Biologie – Géologie ,المعهد العالي للتعليم التقني بروصوISET : Institut Supérieur d'Enseignement et de Technologies,1,10.46,جذع مشتركTronc commun ,11.22,(جامعة نواكشوط العصرية ( كلية العلوم و التقنيات UNA (Faculté des Sciences et Techniques),2,10.68,البيولوجيا – الجيولوجيا Biologie – Géologie ,9.48,(جامعة نواكشوط العصرية (كلية العلوم القانونية والاقتصاديةUNA (Faculté des Sciences Juridiques et Economiques),3,7.60,الاقتصاد  Economie,5.38,(جامعة نواكشوط العصرية ( كلية العلوم و التقنيات UNA (Faculté des Sciences et Techniques),4,9.58,الفيزياء - الكيمياءPhysique-chimie,12.53,المعهد العالي للمحاسبة و إدارة المؤسساتISCAE - Institut Supérieur de Comptabilité et d'Administration des Entreprises,5,7.16,البنك – التأمين Banque et Assurances,11.02,المعهد العالي للمحاسبة و إدارة المؤسساتISCAE - Institut Supérieur de Comptabilité et d'Administration des Entreprises,6,7.16,المالية - المحاسبةFinance et Comptabilité,11.85,(جامعة نواكشوط العصرية (كلية العلوم القانونية والاقتصاديةUNA (Faculté des Sciences Juridiques et Economiques),7,9.11,تسيير الموارد البشريةGestion des ressources humaines,8.46,(جامعة نواكشوط العصرية (كلية العلوم القانونية والاقتصاديةUNA (Faculté des Sciences Juridiques et Economiques),8,9.11,المالية - المحاسبةFinance et Comptabilité,9.90, (جامعة نواكشوط العصرية (المعهد الجامعي المهنيUNA (IUP : Institut Universitaire Professionnel),9,7.79,اللوجستية والنقل Logistiques et Transport ,10.57,المعهد العالي للمحاسبة و إدارة المؤسساتISCAE - Institut Supérieur de Comptabilité et d'Administration des Entreprises,10,7.16,تسيير الموارد البشريةGestion des Ressources Humaines,10.76,المعهد العالي للمحاسبة و إدارة المؤسساتISCAE - Institut Supérieur de Comptabilité et d'Administration des Entreprises,11,7.16,التنمية المعلوماتيةDéveloppement informatique,10.84, (جامعة نواكشوط العصرية (المعهد الجامعي المهنيUNA (IUP : Institut Universitaire Professionnel),12,7.79,التهيئة الصناعيةManagement ,10.32,المعهد العالي للمحاسبة و إدارة المؤسساتISCAE - Institut Supérieur de Comptabilité et d'Administration des Entreprises,13,7.16,تقنيات التجارة و التسويقTechniques Commerciales et Marketing ,10.63,المعهد العالي للمحاسبة و إدارة المؤسساتISCAE - Institut Supérieur de Comptabilité et d'Administration des Entreprises,14,7.16,معلوماتية التسييرInformatique de Gestion,10.89,(جامعة نواكشوط العصرية (كلية العلوم القانونية والاقتصاديةUNA (Faculté des Sciences Juridiques et Economiques),15,9.11,البنك والتأمين Banques Assurances ,9.10,(جامعة نواكشوط العصرية ( كلية الآداب والعلوم الإنسانيةUNA (Faculté des Lettres et Sciences Humaines),16,7.31,البيئة و التنمية المستدامةEnvironnement et Développement durable,9.29,(جامعة نواكشوط العصرية ( كلية الآداب والعلوم الإنسانيةUNA (Faculté des Lettres et Sciences Humaines),17,7.50,الإنجليزيةAnglais,10.11,(جامعة نواكشوط العصرية ( كلية الآداب والعلوم الإنسانيةUNA (Faculté des Lettres et Sciences Humaines),18,6.83,الصينيةChinois,8.44,(جامعة نواكشوط العصرية ( كلية الآداب والعلوم الإنسانيةUNA (Faculté des Lettres et Sciences Humaines),19,6.83,الاسبانيةEspagnol,9.15,"المعهد العالي للغات والترجمة والترجمة الفوريةISPLTI (Institut Supérieur Professionnel des Langues, de Traduction et d'Interprétariat)",20,8.38,جذع مشتركISPLTI,10.55,"المعهد العالي لمهن البناء و الأشغال العامة و الإسكان بألاكInstitut Supérieur des Métiers du Bâtiment, des Travaux Publics  et d'Urbanisme d'Aleg",21,10.46,جذع مشتركTronc commun,0.00,(جامعة نواكشوط العصرية ( كلية الآداب والعلوم الإنسانيةUNA (Faculté des Lettres et Sciences Humaines),22,7.69,الجغرافياGéographie ,5.31,null,null,null,null,null,null,null,null,null,null,null,null,null,null,null,null,null,null,null,null,null,null,null,null,null,null,null,null,null,null,null,null,null,null,null,null,null,null,null,null,null,null,null,null,null
60,10704,البيولوجيا – الجيولوجيا Biologie – Géologie ,(جامعة نواكشوط العصرية ( كلية العلوم و التقنيات UNA (Faculté des Sciences et Techniques),1,12.84,البيولوجيا – الجيولوجيا Biologie – Géologie ,9.48,(جامعة نواكشوط العصرية ( كلية العلوم و التقنيات UNA (Faculté des Sciences et Techniques),2,10.40,الفيزياء - الكيمياءPhysique-chimie,12.53, (جامعة نواكشوط العصرية (المعهد الجامعي المهنيUNA (IUP : Institut Universitaire Professionnel),3,8.90,اللوجستية والنقل Logistiques et Transport ,10.57, (جامعة نواكشوط العصرية (المعهد الجامعي المهنيUNA (IUP : Institut Universitaire Professionnel),4,8.90,التهيئة الصناعيةManagement ,10.32,المعهد العالي للمحاسبة و إدارة المؤسساتISCAE - Institut Supérieur de Comptabilité et d'Administration des Entreprises,5,9.07,المالية - المحاسبةFinance et Comptabilité,11.85,المعهد العالي للمحاسبة و إدارة المؤسساتISCAE - Institut Supérieur de Comptabilité et d'Administration des Entreprises,6,9.07,البنك – التأمين Banque et Assurances,11.02,المعهد العالي للمحاسبة و إدارة المؤسساتISCAE - Institut Supérieur de Comptabilité et d'Administration des Entreprises,7,9.07,تسيير الموارد البشريةGestion des Ressources Humaines,10.76,المعهد العالي للمحاسبة و إدارة المؤسساتISCAE - Institut Supérieur de Comptabilité et d'Administration des Entreprises,8,9.07,معلوماتية التسييرInformatique de Gestion,10.89,المعهد العالي للمحاسبة و إدارة المؤسساتISCAE - Institut Supérieur de Comptabilité et d'Administration des Entreprises,9,9.07,التنمية المعلوماتيةDéveloppement informatique,10.84,المعهد العالي للمحاسبة و إدارة المؤسساتISCAE - Institut Supérieur de Comptabilité et d'Administration des Entreprises,10,9.07,تقنيات التجارة و التسويقTechniques Commerciales et Marketing ,10.63,المعهد العالي للتعليم التقني بروصوISET : Institut Supérieur d'Enseignement et de Technologies,11,12.32,جذع مشتركTronc commun ,11.22,(جامعة نواكشوط العصرية (كلية العلوم القانونية والاقتصاديةUNA (Faculté des Sciences Juridiques et Economiques),12,11.31,المالية - المحاسبةFinance et Comptabilité,9.90,(جامعة نواكشوط العصرية (كلية العلوم القانونية والاقتصاديةUNA (Faculté des Sciences Juridiques et Economiques),13,11.31,البنك والتأمين Banques Assurances ,9.10,(جامعة نواكشوط العصرية (كلية العلوم القانونية والاقتصاديةUNA (Faculté des Sciences Juridiques et Economiques),14,11.31,تسيير الموارد البشريةGestion des ressources humaines,8.46,(جامعة نواكشوط العصرية (كلية العلوم القانونية والاقتصاديةUNA (Faculté des Sciences Juridiques et Economiques),15,8.83,الاقتصاد  Economie,5.38,(جامعة نواكشوط العصرية ( كلية الآداب والعلوم الإنسانيةUNA (Faculté des Lettres et Sciences Humaines),16,9.29,الجغرافياGéographie ,5.31,(جامعة نواكشوط العصرية ( كلية الآداب والعلوم الإنسانيةUNA (Faculté des Lettres et Sciences Humaines),17,8.23,البيئة و التنمية المستدامةEnvironnement et Développement durable,9.29,(جامعة نواكشوط العصرية ( كلية الآداب والعلوم الإنسانيةUNA (Faculté des Lettres et Sciences Humaines),18,7.33,الإنجليزيةAnglais,10.11,(جامعة نواكشوط العصرية ( كلية الآداب والعلوم الإنسانيةUNA (Faculté des Lettres et Sciences Humaines),19,8.05,الصينيةChinois,8.44,(جامعة نواكشوط العصرية ( كلية الآداب والعلوم الإنسانيةUNA (Faculté des Lettres et Sciences Humaines),20,8.05,الاسبانيةEspagnol,9.15,"المعهد العالي للغات والترجمة والترجمة الفوريةISPLTI (Institut Supérieur Professionnel des Langues, de Traduction et d'Interprétariat)",21,9.32,جذع مشتركISPLTI,10.55,"المعهد العالي لمهن البناء و الأشغال العامة و الإسكان بألاكInstitut Supérieur des Métiers du Bâtiment, des Travaux Publics  et d'Urbanisme d'Aleg",22,12.32,جذع مشتركTronc commun,0.00,null,null,null,null,null,null,null,null,null,null,null,null,null,null,null,null,null,null,null,null,null,null,null,null,null,null,null,null,null,null,null,null,null,null,null,null,null,null,null,null,null,null,null,null,null
61,10945,جذع مشتركTronc Commun,المعهد العالي للدراسات والبحوث الإسلاميةISERI (Institut Supérieur des Etudes et de la Recherche Islamiques),1,14.30,جذع مشتركTronc Commun,10.14,(جامعة نواكشوط العصرية ( كلية الآداب والعلوم الإنسانيةUNA (Faculté des Lettres et Sciences Humaines),2,13.18,للغة العربية وآدابهاEtudes arabes,9.71,(جامعة العيون الإسلامية ( كلية الشريعة Université d'Aioun (Faculté Cheria),3,14.30,جذع مشتركTronc commun,8.18,(جامعة العيون الإسلامية (كلية أصول الدينUniversité d'Aioun (Faculté OUSSOULDINE),4,14.30,جذع مشتركTronc commun,8.36,(جامعة العيون الإسلامية  (كلية اللغة العربية والعلوم الإنسانية Université d'Aioun (FLSH),5,15.01,جذع مشتركTronc commun,7.02,المحظرة الشنقيطية الكبرىGrand Mahadra de Chinguitti d'Akjoujt,6,14.30,جذع مشتركTronc commun,7.52,(جامعة نواكشوط العصرية ( كلية الآداب والعلوم الإنسانيةUNA (Faculté des Lettres et Sciences Humaines),7,12.56,الفلسفة وعلم الاجتماعPhilosophie ,9.49,(جامعة نواكشوط العصرية ( كلية الآداب والعلوم الإنسانيةUNA (Faculté des Lettres et Sciences Humaines),8,10.75,الجغرافياGéographie ,0.00,(جامعة نواكشوط العصرية ( كلية الآداب والعلوم الإنسانيةUNA (Faculté des Lettres et Sciences Humaines),9,10.94,التاريخ Histoire  et Civilisation,9.32,(جامعة نواكشوط العصرية ( كلية الآداب والعلوم الإنسانيةUNA (Faculté des Lettres et Sciences Humaines),10,11.19,الاسبانيةEspagnol,0.00,(جامعة نواكشوط العصرية ( كلية الآداب والعلوم الإنسانيةUNA (Faculté des Lettres et Sciences Humaines),11,11.19,الصينيةChinois,0.00,(جامعة نواكشوط العصرية ( كلية الآداب والعلوم الإنسانيةUNA (Faculté des Lettres et Sciences Humaines),12,12.56,Sociologie ,9.09,(جامعة نواكشوط العصرية ( كلية الآداب والعلوم الإنسانيةUNA (Faculté des Lettres et Sciences Humaines),13,11.27,العمل الاجتماعيTravail social,7.54,(جامعة نواكشوط العصرية ( كلية الآداب والعلوم الإنسانيةUNA (Faculté des Lettres et Sciences Humaines),14,12.82,التنمية المحليةDéveloppement local,10.20,(جامعة نواكشوط العصرية ( كلية الآداب والعلوم الإنسانيةUNA (Faculté des Lettres et Sciences Humaines),15,8.06,البيئة و التنمية المستدامةEnvironnement et Développement durable,6.70,(جامعة نواكشوط العصرية (كلية العلوم القانونية والاقتصاديةUNA (Faculté des Sciences Juridiques et Economiques),16,13.39,القانونDroit ,11.06,(جامعة نواكشوط العصرية ( كلية الآداب والعلوم الإنسانيةUNA (Faculté des Lettres et Sciences Humaines),17,11.19,اللغات الوطنية واللسانياتLangues nationales et linguistique,0.00,null,null,null,null,null,null,null,null,null,null,null,null,null,null,null,null,null,null,null,null,null,null,null,null,null,null,null,null,null,null,null,null,null,null,null,null,null,null,null,null,null,null,null,null,null,null,null,null,null,null,null,null,null,null,null,null,null,null,null,null,null,null,null,null,null,null,null,null,null,null
62,10952,التنمية المحليةDéveloppement local,المعهد العالي للدراسات والبحوث الإسلاميةISERI (Institut Supérieur des Etudes et de la Recherche Islamiques),1,9.55,جذع مشتركTronc Commun,10.14,(جامعة نواكشوط العصرية ( كلية الآداب والعلوم الإنسانيةUNA (Faculté des Lettres et Sciences Humaines),2,8.98,للغة العربية وآدابهاEtudes arabes,9.71,(جامعة نواكشوط العصرية ( كلية الآداب والعلوم الإنسانيةUNA (Faculté des Lettres et Sciences Humaines),3,6.88,الفلسفة وعلم الاجتماعPhilosophie ,9.49,(جامعة نواكشوط العصرية ( كلية الآداب والعلوم الإنسانيةUNA (Faculté des Lettres et Sciences Humaines),4,8.13,التاريخ Histoire  et Civilisation,9.32,(جامعة نواكشوط العصرية ( كلية الآداب والعلوم الإنسانيةUNA (Faculté des Lettres et Sciences Humaines),5,7.50,الجغرافياGéographie ,0.00,(جامعة نواكشوط العصرية ( كلية الآداب والعلوم الإنسانيةUNA (Faculté des Lettres et Sciences Humaines),6,5.63,البيئة و التنمية المستدامةEnvironnement et Développement durable,6.70,(جامعة نواكشوط العصرية ( كلية الآداب والعلوم الإنسانيةUNA (Faculté des Lettres et Sciences Humaines),7,11.37,التنمية المحليةDéveloppement local,10.20,(جامعة نواكشوط العصرية (كلية العلوم القانونية والاقتصاديةUNA (Faculté des Sciences Juridiques et Economiques),8,10.09,القانونDroit ,11.06,(جامعة نواكشوط العصرية ( كلية الآداب والعلوم الإنسانيةUNA (Faculté des Lettres et Sciences Humaines),9,7.96,اللغات الوطنية واللسانياتLangues nationales et linguistique,0.00,(جامعة نواكشوط العصرية ( كلية الآداب والعلوم الإنسانيةUNA (Faculté des Lettres et Sciences Humaines),10,8.47,العمل الاجتماعيTravail social,7.54,(جامعة نواكشوط العصرية ( كلية الآداب والعلوم الإنسانيةUNA (Faculté des Lettres et Sciences Humaines),11,6.88,Sociologie ,9.09,(جامعة نواكشوط العصرية ( كلية الآداب والعلوم الإنسانيةUNA (Faculté des Lettres et Sciences Humaines),12,7.96,الصينيةChinois,0.00,(جامعة نواكشوط العصرية ( كلية الآداب والعلوم الإنسانيةUNA (Faculté des Lettres et Sciences Humaines),13,7.96,الاسبانيةEspagnol,0.00,المحظرة الشنقيطية الكبرىGrand Mahadra de Chinguitti d'Akjoujt,14,9.55,جذع مشتركTronc commun,7.52,(جامعة العيون الإسلامية (كلية أصول الدينUniversité d'Aioun (Faculté OUSSOULDINE),15,9.55,جذع مشتركTronc commun,8.36,(جامعة العيون الإسلامية ( كلية الشريعة Université d'Aioun (Faculté Cheria),16,9.55,جذع مشتركTronc commun,8.18,(جامعة العيون الإسلامية  (كلية اللغة العربية والعلوم الإنسانية Université d'Aioun (FLSH),17,9.05,جذع مشتركTronc commun,7.02,null,null,null,null,null,null,null,null,null,null,null,null,null,null,null,null,null,null,null,null,null,null,null,null,null,null,null,null,null,null,null,null,null,null,null,null,null,null,null,null,null,null,null,null,null,null,null,null,null,null,null,null,null,null,null,null,null,null,null,null,null,null,null,null,null,null,null,null,null,null
63,10953,للغة العربية وآدابهاEtudes arabes,(جامعة نواكشوط العصرية ( كلية الآداب والعلوم الإنسانيةUNA (Faculté des Lettres et Sciences Humaines),1,10.82,للغة العربية وآدابهاEtudes arabes,9.71,(جامعة نواكشوط العصرية ( كلية الآداب والعلوم الإنسانيةUNA (Faculté des Lettres et Sciences Humaines),2,8.48,الفلسفة وعلم الاجتماعPhilosophie ,9.49,(جامعة نواكشوط العصرية ( كلية الآداب والعلوم الإنسانيةUNA (Faculté des Lettres et Sciences Humaines),3,6.93,التاريخ Histoire  et Civilisation,9.32,المحظرة الشنقيطية الكبرىGrand Mahadra de Chinguitti d'Akjoujt,4,13.25,جذع مشتركTronc commun,7.52,(جامعة العيون الإسلامية (كلية أصول الدينUniversité d'Aioun (Faculté OUSSOULDINE),5,13.25,جذع مشتركTronc commun,8.36,(جامعة العيون الإسلامية ( كلية الشريعة Université d'Aioun (Faculté Cheria),6,13.25,جذع مشتركTronc commun,8.18,(جامعة العيون الإسلامية  (كلية اللغة العربية والعلوم الإنسانية Université d'Aioun (FLSH),7,12.06,جذع مشتركTronc commun,7.02,المعهد العالي للدراسات والبحوث الإسلاميةISERI (Institut Supérieur des Etudes et de la Recherche Islamiques),8,13.25,جذع مشتركTronc Commun,10.14,(جامعة نواكشوط العصرية (كلية العلوم القانونية والاقتصاديةUNA (Faculté des Sciences Juridiques et Economiques),9,12.94,القانونDroit ,11.06,(جامعة نواكشوط العصرية ( كلية الآداب والعلوم الإنسانيةUNA (Faculté des Lettres et Sciences Humaines),10,5.52,البيئة و التنمية المستدامةEnvironnement et Développement durable,6.70,(جامعة نواكشوط العصرية ( كلية الآداب والعلوم الإنسانيةUNA (Faculté des Lettres et Sciences Humaines),11,10.00,التنمية المحليةDéveloppement local,10.20,(جامعة نواكشوط العصرية ( كلية الآداب والعلوم الإنسانيةUNA (Faculté des Lettres et Sciences Humaines),12,8.02,العمل الاجتماعيTravail social,7.54,(جامعة نواكشوط العصرية ( كلية الآداب والعلوم الإنسانيةUNA (Faculté des Lettres et Sciences Humaines),13,8.48,Sociologie ,9.09,(جامعة نواكشوط العصرية ( كلية الآداب والعلوم الإنسانيةUNA (Faculté des Lettres et Sciences Humaines),14,8.80,الصينيةChinois,0.00,(جامعة نواكشوط العصرية ( كلية الآداب والعلوم الإنسانيةUNA (Faculté des Lettres et Sciences Humaines),15,8.80,الاسبانيةEspagnol,0.00,(جامعة نواكشوط العصرية ( كلية الآداب والعلوم الإنسانيةUNA (Faculté des Lettres et Sciences Humaines),16,7.36,الجغرافياGéographie ,0.00,(جامعة نواكشوط العصرية ( كلية الآداب والعلوم الإنسانيةUNA (Faculté des Lettres et Sciences Humaines),17,8.80,اللغات الوطنية واللسانياتLangues nationales et linguistique,0.00,null,null,null,null,null,null,null,null,null,null,null,null,null,null,null,null,null,null,null,null,null,null,null,null,null,null,null,null,null,null,null,null,null,null,null,null,null,null,null,null,null,null,null,null,null,null,null,null,null,null,null,null,null,null,null,null,null,null,null,null,null,null,null,null,null,null,null,null,null,null
64,10955,جذع مشتركTronc commun,(جامعة نواكشوط العصرية ( كلية الآداب والعلوم الإنسانيةUNA (Faculté des Lettres et Sciences Humaines),1,6.04,البيئة و التنمية المستدامةEnvironnement et Développement durable,6.70,(جامعة نواكشوط العصرية ( كلية الآداب والعلوم الإنسانيةUNA (Faculté des Lettres et Sciences Humaines),2,6.91,الفلسفة وعلم الاجتماعPhilosophie ,9.49,(جامعة العيون الإسلامية ( كلية الشريعة Université d'Aioun (Faculté Cheria),3,9.82,جذع مشتركTronc commun,8.18,المعهد العالي للدراسات والبحوث الإسلاميةISERI (Institut Supérieur des Etudes et de la Recherche Islamiques),4,9.82,جذع مشتركTronc Commun,10.14,(جامعة نواكشوط العصرية (كلية العلوم القانونية والاقتصاديةUNA (Faculté des Sciences Juridiques et Economiques),5,10.28,القانونDroit ,11.06,(جامعة العيون الإسلامية (كلية أصول الدينUniversité d'Aioun (Faculté OUSSOULDINE),6,9.82,جذع مشتركTronc commun,8.36,(جامعة نواكشوط العصرية ( كلية الآداب والعلوم الإنسانيةUNA (Faculté des Lettres et Sciences Humaines),7,10.00,التنمية المحليةDéveloppement local,10.20,(جامعة العيون الإسلامية  (كلية اللغة العربية والعلوم الإنسانية Université d'Aioun (FLSH),8,9.34,جذع مشتركTronc commun,7.02,(جامعة نواكشوط العصرية ( كلية الآداب والعلوم الإنسانيةUNA (Faculté des Lettres et Sciences Humaines),9,6.91,Sociologie ,9.09,(جامعة نواكشوط العصرية ( كلية الآداب والعلوم الإنسانيةUNA (Faculté des Lettres et Sciences Humaines),10,8.73,للغة العربية وآدابهاEtudes arabes,9.71,(جامعة نواكشوط العصرية ( كلية الآداب والعلوم الإنسانيةUNA (Faculté des Lettres et Sciences Humaines),11,8.54,التاريخ Histoire  et Civilisation,9.32,(جامعة نواكشوط العصرية ( كلية الآداب والعلوم الإنسانيةUNA (Faculté des Lettres et Sciences Humaines),12,8.05,الجغرافياGéographie ,0.00,المحظرة الشنقيطية الكبرىGrand Mahadra de Chinguitti d'Akjoujt,13,9.82,جذع مشتركTronc commun,7.52,(جامعة نواكشوط العصرية ( كلية الآداب والعلوم الإنسانيةUNA (Faculté des Lettres et Sciences Humaines),14,8.54,العمل الاجتماعيTravail social,7.54,(جامعة نواكشوط العصرية ( كلية الآداب والعلوم الإنسانيةUNA (Faculté des Lettres et Sciences Humaines),15,8.05,اللغات الوطنية واللسانياتLangues nationales et linguistique,0.00,(جامعة نواكشوط العصرية ( كلية الآداب والعلوم الإنسانيةUNA (Faculté des Lettres et Sciences Humaines),16,8.05,الاسبانيةEspagnol,0.00,(جامعة نواكشوط العصرية ( كلية الآداب والعلوم الإنسانيةUNA (Faculté des Lettres et Sciences Humaines),17,8.05,الصينيةChinois,0.00,null,null,null,null,null,null,null,null,null,null,null,null,null,null,null,null,null,null,null,null,null,null,null,null,null,null,null,null,null,null,null,null,null,null,null,null,null,null,null,null,null,null,null,null,null,null,null,null,null,null,null,null,null,null,null,null,null,null,null,null,null,null,null,null,null,null,null,null,null,null
