,Bac_id,field_accepted,country0,field0,choice0,avg0,min_avg0,country1,field1,choice1,avg1,min_avg1,country2,field2,choice2,avg2,min_avg2,country3,field3,choice3,avg3,min_avg3,country4,field4,choice4,avg4,min_avg4,country5,field5,choice5,avg5,min_avg5,country6,field6,choice6,avg6,min_avg6,country7,field7,choice7,avg7,min_avg7,country8,field8,choice8,avg8,min_avg8,country9,field9,choice9,avg9,min_avg9,country10,field10,choice10,avg10,min_avg10,country11,field11,choice11,avg11,min_avg11,country12,field12,choice12,avg12,min_avg12,country13,field13,choice13,avg13,min_avg13,country14,field14,choice14,avg14,min_avg14,country15,field15,choice15,avg15,min_avg15,country16,field16,choice16,avg16,min_avg16,country17,field17,choice17,avg17,min_avg17,country18,field18,choice18,avg18,min_avg18,country19,field19,choice19,avg19,min_avg19,country20,field20,choice20,avg20,min_avg20,country21,field21,choice21,avg21,min_avg21,country22,field22,choice22,avg22,min_avg22,country23,field23,choice23,avg23,min_avg23,country24,field24,choice24,avg24,min_avg24,country25,field25,choice25,avg25,min_avg25,country26,field26,choice26,avg26,min_avg26,country27,field27,choice27,avg27,min_avg27,country28,field28,choice28,avg28,min_avg28,country29,field29,choice29,avg29,min_avg29,country30,field30,choice30,avg30,min_avg30
0,56778,التنمية المحليةDéveloppement local,المعهد العالي للدراسات والبحوث الإسلاميةISERI (Institut Supérieur des Etudes et de la Recherche Islamiques),1,9.55,جذع مشتركTronc Commun,10.14,(جامعة نواكشوط العصرية ( كلية الآداب والعلوم الإنسانيةUNA (Faculté des Lettres et Sciences Humaines),2,8.02,للغة العربية وآدابهاEtudes arabes,9.71,(جامعة نواكشوط العصرية (كلية العلوم القانونية والاقتصاديةUNA (Faculté des Sciences Juridiques et Economiques),3,10.03,القانونDroit ,11.06,(جامعة نواكشوط العصرية ( كلية الآداب والعلوم الإنسانيةUNA (Faculté des Lettres et Sciences Humaines),4,10.96,التنمية المحليةDéveloppement local,10.20,(جامعة نواكشوط العصرية ( كلية الآداب والعلوم الإنسانيةUNA (Faculté des Lettres et Sciences Humaines),5,6.35,الفلسفة وعلم الاجتماعPhilosophie ,9.49,(جامعة نواكشوط العصرية ( كلية الآداب والعلوم الإنسانيةUNA (Faculté des Lettres et Sciences Humaines),6,5.53,البيئة و التنمية المستدامةEnvironnement et Développement durable,6.70,(جامعة نواكشوط العصرية ( كلية الآداب والعلوم الإنسانيةUNA (Faculté des Lettres et Sciences Humaines),7,8.27,العمل الاجتماعيTravail social,7.54,(جامعة نواكشوط العصرية ( كلية الآداب والعلوم الإنسانيةUNA (Faculté des Lettres et Sciences Humaines),8,6.35,Sociologie ,9.09,(جامعة نواكشوط العصرية ( كلية الآداب والعلوم الإنسانيةUNA (Faculté des Lettres et Sciences Humaines),9,6.78,الصينيةChinois,0.00,(جامعة نواكشوط العصرية ( كلية الآداب والعلوم الإنسانيةUNA (Faculté des Lettres et Sciences Humaines),10,6.78,الاسبانيةEspagnol,0.00,(جامعة نواكشوط العصرية ( كلية الآداب والعلوم الإنسانيةUNA (Faculté des Lettres et Sciences Humaines),11,8.72,التاريخ Histoire  et Civilisation,9.32,(جامعة نواكشوط العصرية ( كلية الآداب والعلوم الإنسانيةUNA (Faculté des Lettres et Sciences Humaines),12,7.38,الجغرافياGéographie ,0.00,(جامعة نواكشوط العصرية ( كلية الآداب والعلوم الإنسانيةUNA (Faculté des Lettres et Sciences Humaines),13,6.78,اللغات الوطنية واللسانياتLangues nationales et linguistique,0.00,(جامعة العيون الإسلامية  (كلية اللغة العربية والعلوم الإنسانية Université d'Aioun (FLSH),14,9.26,جذع مشتركTronc commun,7.02,(جامعة العيون الإسلامية ( كلية الشريعة Université d'Aioun (Faculté Cheria),15,9.55,جذع مشتركTronc commun,8.18,المحظرة الشنقيطية الكبرىGrand Mahadra de Chinguitti d'Akjoujt,16,9.55,جذع مشتركTronc commun,7.52,(جامعة العيون الإسلامية (كلية أصول الدينUniversité d'Aioun (Faculté OUSSOULDINE),17,9.55,جذع مشتركTronc commun,8.36,null,null,null,null,null,null,null,null,null,null,null,null,null,null,null,null,null,null,null,null,null,null,null,null,null,null,null,null,null,null,null,null,null,null,null,null,null,null,null,null,null,null,null,null,null,null,null,null,null,null,null,null,null,null,null,null,null,null,null,null,null,null,null,null,null,null,null,null,null,null
1,50971,القانونDroit ,(جامعة نواكشوط العصرية (كلية العلوم القانونية والاقتصاديةUNA (Faculté des Sciences Juridiques et Economiques),1,11.66,القانونDroit ,11.06,(جامعة نواكشوط العصرية ( كلية الآداب والعلوم الإنسانيةUNA (Faculté des Lettres et Sciences Humaines),2,7.33,Sociologie ,9.09,(جامعة نواكشوط العصرية ( كلية الآداب والعلوم الإنسانيةUNA (Faculté des Lettres et Sciences Humaines),3,7.44,الاسبانيةEspagnol,0.00,(جامعة نواكشوط العصرية ( كلية الآداب والعلوم الإنسانيةUNA (Faculté des Lettres et Sciences Humaines),4,7.44,الصينيةChinois,0.00,(جامعة نواكشوط العصرية ( كلية الآداب والعلوم الإنسانيةUNA (Faculté des Lettres et Sciences Humaines),5,10.68,التاريخ Histoire  et Civilisation,9.32,(جامعة نواكشوط العصرية ( كلية الآداب والعلوم الإنسانيةUNA (Faculté des Lettres et Sciences Humaines),6,9.17,الجغرافياGéographie ,0.00,(جامعة نواكشوط العصرية ( كلية الآداب والعلوم الإنسانيةUNA (Faculté des Lettres et Sciences Humaines),7,6.88,البيئة و التنمية المستدامةEnvironnement et Développement durable,6.70,(جامعة نواكشوط العصرية ( كلية الآداب والعلوم الإنسانيةUNA (Faculté des Lettres et Sciences Humaines),8,10.00,التنمية المحليةDéveloppement local,10.20,(جامعة نواكشوط العصرية ( كلية الآداب والعلوم الإنسانيةUNA (Faculté des Lettres et Sciences Humaines),9,9.38,العمل الاجتماعيTravail social,7.54,(جامعة نواكشوط العصرية ( كلية الآداب والعلوم الإنسانيةUNA (Faculté des Lettres et Sciences Humaines),10,7.33,الفلسفة وعلم الاجتماعPhilosophie ,9.49,(جامعة نواكشوط العصرية ( كلية الآداب والعلوم الإنسانيةUNA (Faculté des Lettres et Sciences Humaines),11,8.26,للغة العربية وآدابهاEtudes arabes,9.71,(جامعة نواكشوط العصرية ( كلية الآداب والعلوم الإنسانيةUNA (Faculté des Lettres et Sciences Humaines),12,7.44,اللغات الوطنية واللسانياتLangues nationales et linguistique,0.00,(جامعة العيون الإسلامية  (كلية اللغة العربية والعلوم الإنسانية Université d'Aioun (FLSH),13,10.51,جذع مشتركTronc commun,7.02,(جامعة العيون الإسلامية ( كلية الشريعة Université d'Aioun (Faculté Cheria),14,11.64,جذع مشتركTronc commun,8.18,(جامعة العيون الإسلامية (كلية أصول الدينUniversité d'Aioun (Faculté OUSSOULDINE),15,11.64,جذع مشتركTronc commun,8.36,المحظرة الشنقيطية الكبرىGrand Mahadra de Chinguitti d'Akjoujt,16,11.64,جذع مشتركTronc commun,7.52,المعهد العالي للدراسات والبحوث الإسلاميةISERI (Institut Supérieur des Etudes et de la Recherche Islamiques),17,11.64,جذع مشتركTronc Commun,10.14,null,null,null,null,null,null,null,null,null,null,null,null,null,null,null,null,null,null,null,null,null,null,null,null,null,null,null,null,null,null,null,null,null,null,null,null,null,null,null,null,null,null,null,null,null,null,null,null,null,null,null,null,null,null,null,null,null,null,null,null,null,null,null,null,null,null,null,null,null,null
2,52687, Institut Supérieur des Metiers de la Mine (IS2M)- ZTE,MAURITANIE,1,9.29,FM: Médecine UNA,9.89,MAURITANIE,2,9.29,CPGE (Classes Préparatoires aux Grandes Ecoles) ,10.34,MAURITANIE,3,9.29,Institut Supérieur des Metiers de la Mine (IS2M)- ZTE,8.64,MAURITANIE,4,9.29,Institut Supérieur des Métiers de l'Energie,9.25,MAROC,5,9.29,Ecole Nationale des Sciences Appliquées (ENSA),13.42,TUNISIE,6,9.29,Classe préparatoires aux écoles d'ingénieurs( PC),14.64,MAURITANIE,7,9.29,Institut Supérieur des Métiers du Numérique,7.82,MAURITANIE,8,9.29,Institut Supérieur des Métiers de la Statistique(ISMS),7.79,MAURITANIE,9,9.29,Institut Supérieur de la Science de la Mer (ISSM) - NDB,8.32,MAURITANIE,10,9.29,"Institut Supérieur des Métiers du Batiment, des Travaux Publics et  et d'Urbanisme d'Aleg)",8.93,null,null,null,null,null,null,null,null,null,null,null,null,null,null,null,null,null,null,null,null,null,null,null,null,null,null,null,null,null,null,null,null,null,null,null,null,null,null,null,null,null,null,null,null,null,null,null,null,null,null,null,null,null,null,null,null,null,null,null,null,null,null,null,null,null,null,null,null,null,null,null,null,null,null,null,null,null,null,null,null,null,null,null,null,null,null,null,null,null,null,null,null,null,null,null,null,null,null,null,null,null,null,null,null,null
3,13262,الفيزياء - الكيمياءPhysique-chimie,المعهد العالي للمحاسبة و إدارة المؤسساتISCAE - Institut Supérieur de Comptabilité et d'Administration des Entreprises,1,9.05,المالية - المحاسبةFinance et Comptabilité,11.85,المعهد العالي للمحاسبة و إدارة المؤسساتISCAE - Institut Supérieur de Comptabilité et d'Administration des Entreprises,2,9.05,البنك – التأمين Banque et Assurances,11.02,(جامعة نواكشوط العصرية ( كلية العلوم و التقنيات UNA (Faculté des Sciences et Techniques),3,8.34,البيولوجيا – الجيولوجيا Biologie – Géologie ,9.48,المعهد العالي للمحاسبة و إدارة المؤسساتISCAE - Institut Supérieur de Comptabilité et d'Administration des Entreprises,4,9.05,تسيير الموارد البشريةGestion des Ressources Humaines,10.76,المعهد العالي للمحاسبة و إدارة المؤسساتISCAE - Institut Supérieur de Comptabilité et d'Administration des Entreprises,5,9.05,تقنيات التجارة و التسويقTechniques Commerciales et Marketing ,10.63,المعهد العالي للمحاسبة و إدارة المؤسساتISCAE - Institut Supérieur de Comptabilité et d'Administration des Entreprises,6,9.05,التنمية المعلوماتيةDéveloppement informatique,10.84,(جامعة نواكشوط العصرية (كلية العلوم القانونية والاقتصاديةUNA (Faculté des Sciences Juridiques et Economiques),7,7.13,البنك والتأمين Banques Assurances ,9.10, (جامعة نواكشوط العصرية (المعهد الجامعي المهنيUNA (IUP : Institut Universitaire Professionnel),8,10.19,اللوجستية والنقل Logistiques et Transport ,10.57,(جامعة نواكشوط العصرية ( كلية العلوم و التقنيات UNA (Faculté des Sciences et Techniques),9,13.69,الفيزياء - الكيمياءPhysique-chimie,12.53, (جامعة نواكشوط العصرية (المعهد الجامعي المهنيUNA (IUP : Institut Universitaire Professionnel),10,10.19,التهيئة الصناعيةManagement ,10.32,(جامعة نواكشوط العصرية (كلية العلوم القانونية والاقتصاديةUNA (Faculté des Sciences Juridiques et Economiques),11,7.13,المالية - المحاسبةFinance et Comptabilité,9.90,المعهد العالي للمحاسبة و إدارة المؤسساتISCAE - Institut Supérieur de Comptabilité et d'Administration des Entreprises,12,9.05,معلوماتية التسييرInformatique de Gestion,10.89,المعهد العالي للتعليم التقني بروصوISET : Institut Supérieur d'Enseignement et de Technologies,13,9.80,جذع مشتركTronc commun ,11.22,(جامعة نواكشوط العصرية (كلية العلوم القانونية والاقتصاديةUNA (Faculté des Sciences Juridiques et Economiques),14,7.13,تسيير الموارد البشريةGestion des ressources humaines,8.46,(جامعة نواكشوط العصرية (كلية العلوم القانونية والاقتصاديةUNA (Faculté des Sciences Juridiques et Economiques),15,9.68,الاقتصاد  Economie,5.38,(جامعة نواكشوط العصرية ( كلية الآداب والعلوم الإنسانيةUNA (Faculté des Lettres et Sciences Humaines),16,7.19,الجغرافياGéographie ,5.31,(جامعة نواكشوط العصرية ( كلية الآداب والعلوم الإنسانيةUNA (Faculté des Lettres et Sciences Humaines),17,8.91,البيئة و التنمية المستدامةEnvironnement et Développement durable,9.29,(جامعة نواكشوط العصرية ( كلية الآداب والعلوم الإنسانيةUNA (Faculté des Lettres et Sciences Humaines),18,8.31,الإنجليزيةAnglais,10.11,(جامعة نواكشوط العصرية ( كلية الآداب والعلوم الإنسانيةUNA (Faculté des Lettres et Sciences Humaines),19,7.63,الصينيةChinois,8.44,(جامعة نواكشوط العصرية ( كلية الآداب والعلوم الإنسانيةUNA (Faculté des Lettres et Sciences Humaines),20,7.63,الاسبانيةEspagnol,9.15,"المعهد العالي للغات والترجمة والترجمة الفوريةISPLTI (Institut Supérieur Professionnel des Langues, de Traduction et d'Interprétariat)",21,11.19,جذع مشتركISPLTI,10.55,"المعهد العالي لمهن البناء و الأشغال العامة و الإسكان بألاكInstitut Supérieur des Métiers du Bâtiment, des Travaux Publics  et d'Urbanisme d'Aleg",22,9.80,جذع مشتركTronc commun,0.00,null,null,null,null,null,null,null,null,null,null,null,null,null,null,null,null,null,null,null,null,null,null,null,null,null,null,null,null,null,null,null,null,null,null,null,null,null,null,null,null,null,null,null,null,null
4,45842,الاقتصاد  Economie,(جامعة نواكشوط العصرية ( كلية العلوم و التقنيات UNA (Faculté des Sciences et Techniques),1,6.50,البيولوجيا – الجيولوجيا Biologie – Géologie ,9.48, (جامعة نواكشوط العصرية (المعهد الجامعي المهنيUNA (IUP : Institut Universitaire Professionnel),2,10.15,اللوجستية والنقل Logistiques et Transport ,10.57,المعهد العالي للمحاسبة و إدارة المؤسساتISCAE - Institut Supérieur de Comptabilité et d'Administration des Entreprises,3,9.24,المالية - المحاسبةFinance et Comptabilité,11.85,المعهد العالي للمحاسبة و إدارة المؤسساتISCAE - Institut Supérieur de Comptabilité et d'Administration des Entreprises,4,9.24,البنك – التأمين Banque et Assurances,11.02,المعهد العالي للمحاسبة و إدارة المؤسساتISCAE - Institut Supérieur de Comptabilité et d'Administration des Entreprises,5,9.24,تسيير الموارد البشريةGestion des Ressources Humaines,10.76,المعهد العالي للمحاسبة و إدارة المؤسساتISCAE - Institut Supérieur de Comptabilité et d'Administration des Entreprises,6,9.24,معلوماتية التسييرInformatique de Gestion,10.89,المعهد العالي للمحاسبة و إدارة المؤسساتISCAE - Institut Supérieur de Comptabilité et d'Administration des Entreprises,7,9.24,التنمية المعلوماتيةDéveloppement informatique,10.84,المعهد العالي للمحاسبة و إدارة المؤسساتISCAE - Institut Supérieur de Comptabilité et d'Administration des Entreprises,8,9.24,تقنيات التجارة و التسويقTechniques Commerciales et Marketing ,10.63,المعهد العالي للتعليم التقني بروصوISET : Institut Supérieur d'Enseignement et de Technologies,9,7.99,جذع مشتركTronc commun ,11.22,(جامعة نواكشوط العصرية (كلية العلوم القانونية والاقتصاديةUNA (Faculté des Sciences Juridiques et Economiques),10,6.24,المالية - المحاسبةFinance et Comptabilité,9.90,(جامعة نواكشوط العصرية (كلية العلوم القانونية والاقتصاديةUNA (Faculté des Sciences Juridiques et Economiques),11,6.24,البنك والتأمين Banques Assurances ,9.10,(جامعة نواكشوط العصرية (كلية العلوم القانونية والاقتصاديةUNA (Faculté des Sciences Juridiques et Economiques),12,6.24,تسيير الموارد البشريةGestion des ressources humaines,8.46,(جامعة نواكشوط العصرية (كلية العلوم القانونية والاقتصاديةUNA (Faculté des Sciences Juridiques et Economiques),13,9.78,الاقتصاد  Economie,5.38,(جامعة نواكشوط العصرية ( كلية الآداب والعلوم الإنسانيةUNA (Faculté des Lettres et Sciences Humaines),14,6.81,الجغرافياGéographie ,5.31,(جامعة نواكشوط العصرية ( كلية الآداب والعلوم الإنسانيةUNA (Faculté des Lettres et Sciences Humaines),15,9.23,البيئة و التنمية المستدامةEnvironnement et Développement durable,9.29,(جامعة نواكشوط العصرية ( كلية الآداب والعلوم الإنسانيةUNA (Faculté des Lettres et Sciences Humaines),16,10.25,الإنجليزيةAnglais,10.11,(جامعة نواكشوط العصرية ( كلية الآداب والعلوم الإنسانيةUNA (Faculté des Lettres et Sciences Humaines),17,8.30,الصينيةChinois,8.44,(جامعة نواكشوط العصرية ( كلية الآداب والعلوم الإنسانيةUNA (Faculté des Lettres et Sciences Humaines),18,8.30,الاسبانيةEspagnol,9.15,"المعهد العالي للغات والترجمة والترجمة الفوريةISPLTI (Institut Supérieur Professionnel des Langues, de Traduction et d'Interprétariat)",19,12.32,جذع مشتركISPLTI,10.55,"المعهد العالي لمهن البناء و الأشغال العامة و الإسكان بألاكInstitut Supérieur des Métiers du Bâtiment, des Travaux Publics  et d'Urbanisme d'Aleg",20,7.99,جذع مشتركTronc commun,0.00,(جامعة نواكشوط العصرية ( كلية العلوم و التقنيات UNA (Faculté des Sciences et Techniques),21,12.30,الفيزياء - الكيمياءPhysique-chimie,12.53, (جامعة نواكشوط العصرية (المعهد الجامعي المهنيUNA (IUP : Institut Universitaire Professionnel),22,10.15,التهيئة الصناعيةManagement ,10.32,null,null,null,null,null,null,null,null,null,null,null,null,null,null,null,null,null,null,null,null,null,null,null,null,null,null,null,null,null,null,null,null,null,null,null,null,null,null,null,null,null,null,null,null,null
5,47015,الاقتصاد  Economie,المعهد العالي للمحاسبة و إدارة المؤسساتISCAE - Institut Supérieur de Comptabilité et d'Administration des Entreprises,1,9.05,المالية - المحاسبةFinance et Comptabilité,11.85,المعهد العالي للمحاسبة و إدارة المؤسساتISCAE - Institut Supérieur de Comptabilité et d'Administration des Entreprises,2,9.05,البنك – التأمين Banque et Assurances,11.02,المعهد العالي للمحاسبة و إدارة المؤسساتISCAE - Institut Supérieur de Comptabilité et d'Administration des Entreprises,3,9.05,التنمية المعلوماتيةDéveloppement informatique,10.84,(جامعة نواكشوط العصرية (كلية العلوم القانونية والاقتصاديةUNA (Faculté des Sciences Juridiques et Economiques),4,6.70,المالية - المحاسبةFinance et Comptabilité,9.90,(جامعة نواكشوط العصرية (كلية العلوم القانونية والاقتصاديةUNA (Faculté des Sciences Juridiques et Economiques),5,6.70,البنك والتأمين Banques Assurances ,9.10, (جامعة نواكشوط العصرية (المعهد الجامعي المهنيUNA (IUP : Institut Universitaire Professionnel),6,9.57,اللوجستية والنقل Logistiques et Transport ,10.57, (جامعة نواكشوط العصرية (المعهد الجامعي المهنيUNA (IUP : Institut Universitaire Professionnel),7,9.57,التهيئة الصناعيةManagement ,10.32,(جامعة نواكشوط العصرية ( كلية العلوم و التقنيات UNA (Faculté des Sciences et Techniques),8,6.70,البيولوجيا – الجيولوجيا Biologie – Géologie ,9.48,(جامعة نواكشوط العصرية (كلية العلوم القانونية والاقتصاديةUNA (Faculté des Sciences Juridiques et Economiques),9,6.70,تسيير الموارد البشريةGestion des ressources humaines,8.46,المعهد العالي للمحاسبة و إدارة المؤسساتISCAE - Institut Supérieur de Comptabilité et d'Administration des Entreprises,10,9.05,تقنيات التجارة و التسويقTechniques Commerciales et Marketing ,10.63,المعهد العالي للمحاسبة و إدارة المؤسساتISCAE - Institut Supérieur de Comptabilité et d'Administration des Entreprises,11,9.05,معلوماتية التسييرInformatique de Gestion,10.89,المعهد العالي للمحاسبة و إدارة المؤسساتISCAE - Institut Supérieur de Comptabilité et d'Administration des Entreprises,12,9.05,تسيير الموارد البشريةGestion des Ressources Humaines,10.76,(جامعة نواكشوط العصرية ( كلية العلوم و التقنيات UNA (Faculté des Sciences et Techniques),13,11.07,الفيزياء - الكيمياءPhysique-chimie,12.53,المعهد العالي للتعليم التقني بروصوISET : Institut Supérieur d'Enseignement et de Technologies,14,7.84,جذع مشتركTronc commun ,11.22,(جامعة نواكشوط العصرية ( كلية الآداب والعلوم الإنسانيةUNA (Faculté des Lettres et Sciences Humaines),15,9.10,البيئة و التنمية المستدامةEnvironnement et Développement durable,9.29,(جامعة نواكشوط العصرية (كلية العلوم القانونية والاقتصاديةUNA (Faculté des Sciences Juridiques et Economiques),16,9.38,الاقتصاد  Economie,5.38,(جامعة نواكشوط العصرية ( كلية الآداب والعلوم الإنسانيةUNA (Faculté des Lettres et Sciences Humaines),17,7.07,الإنجليزيةAnglais,10.11,(جامعة نواكشوط العصرية ( كلية الآداب والعلوم الإنسانيةUNA (Faculté des Lettres et Sciences Humaines),18,8.63,الاسبانيةEspagnol,9.15,(جامعة نواكشوط العصرية ( كلية الآداب والعلوم الإنسانيةUNA (Faculté des Lettres et Sciences Humaines),19,8.63,الصينيةChinois,8.44,(جامعة نواكشوط العصرية ( كلية الآداب والعلوم الإنسانيةUNA (Faculté des Lettres et Sciences Humaines),20,7.25,الجغرافياGéographie ,5.31,"المعهد العالي للغات والترجمة والترجمة الفوريةISPLTI (Institut Supérieur Professionnel des Langues, de Traduction et d'Interprétariat)",21,9.13,جذع مشتركISPLTI,10.55,"المعهد العالي لمهن البناء و الأشغال العامة و الإسكان بألاكInstitut Supérieur des Métiers du Bâtiment, des Travaux Publics  et d'Urbanisme d'Aleg",22,7.84,جذع مشتركTronc commun,0.00,null,null,null,null,null,null,null,null,null,null,null,null,null,null,null,null,null,null,null,null,null,null,null,null,null,null,null,null,null,null,null,null,null,null,null,null,null,null,null,null,null,null,null,null,null
